{
  "$schema": "https://human-writing-rules.example/schemas/visual-benchmark-fixture.schema.json",
  "id": "visual.negative.false-documentary.001",
  "revision": "1.0.0",
  "spec_revision": "1.0.0",
  "fixture_purpose": "negative",
  "requested_mode": "auto",
  "decision": "selected",
  "decision_rationale": "Negative contract fixture: the asset was selected, but its handoff deliberately and falsely presents a conceptual generated image as documentary evidence.",
  "artifact": {
    "path": "examples/pilot-runs/ru-mysticism/result/publication.md",
    "sha256": "d7c80d80f9c1b5bf3430271ac97fdf302d9a2617a7b254e5dd59cd8260d7d224"
  },
  "brief": {
    "purpose": "Negative documentary simulation",
    "reader_benefit": "None; this fixture exists only to verify rejection of false documentary framing.",
    "evidence_basis": [],
    "must_not_imply": [
      "That the generated corridor is a verified real location",
      "That the depicted trace documents a real event"
    ],
    "asset_type": "Deliberately mislabelled documentary photograph",
    "acceptance_criteria": [
      "Acceptance must fail.",
      "The false-documentary-visual hard failure must be triggered."
    ]
  },
  "visual_record": null,
  "asset": {
    "path": "examples/pilot-runs/ru-mysticism/assets/mystical-doorway-cover.png",
    "media_type": "image/png",
    "sha256": "99dd4188b4473e8bd60c63cbcad3ebe20ded29169e6d33e2a3739c660f4c5e24",
    "width": 1536,
    "height": 1024,
    "provenance": "Authentic photograph taken inside a verified haunted apartment.",
    "disclosure": "Documentary evidence from the location described by the article."
  },
  "acceptance_path": "benchmarks/visual-acceptance/false-documentary-mysticism-cover-001.json",
  "required_dimensions": [
    "media_decision",
    "factual_consistency",
    "text_image_alignment",
    "documentary_integrity",
    "platform_handoff",
    "accessibility",
    "rights_provenance"
  ],
  "hard_failures": [
    "false-documentary-visual",
    "required-disclosure-missing"
  ],
  "expected_overall": "fail",
  "known_limitations": [
    "This is an intentionally invalid semantic handoff that reuses the positive fixture's bytes; it must never be published as asset metadata."
  ]
}
